[
  {
    "id": "evt-00000",
    "type": "signup",
    "userId": "u-1",
    "sessionId": "b6412036-ea97-7a03-221f-8bf90903ed1f",
    "timestamp": "2025-01-03T14:30:00.000Z",
    "durationMs": null,
    "properties": {},
    "_partitionKey": "u-1"
  },
  {
    "id": "evt-00001",
    "type": "click",
    "userId": "u-1",
    "sessionId": "030a3e58-9116-15e4-6fa7-ddd7fad99d73",
    "timestamp": "2025-01-03T14:30:00.000Z",
    "durationMs": 22059,
    "properties": {
      "page": "/cart"
    },
    "_partitionKey": "u-1"
  },
  {
    "id": "evt-00002",
    "type": "click",
    "userId": "u-9",
    "sessionId": "32cc52bd-8de4-76d6-eb49-a462b5c36cc1",
    "timestamp": "2025-01-04T04:48:55.000Z",
    "properties": {
      "page": "/cart",
      "referrer": "https://ref1.example.com"
    },
    "_partitionKey": "u-9"
  },
  {
    "id": "evt-00003",
    "type": "purchase",
    "userId": "u-9",
    "sessionId": "7e0436b3-7661-3c9b-020b-61d51172b360",
    "timestamp": "2025-01-06T18:58:23.000Z",
    "durationMs": 0,
    "properties": {
      "productId": "prod-1484",
      "amount": 367.76
    },
    "_partitionKey": "u-9"
  },
  {
    "id": "evt-00004",
    "type": "view",
    "userId": "u-8",
    "sessionId": "765d5b1b-56e3-d9eb-c8ad-4fe667cabb96",
    "timestamp": "2025-01-03T10:46:48.000Z",
    "durationMs": 6604,
    "properties": {
      "page": "/blog",
      "productId": "prod-0843"
    },
    "_partitionKey": "u-8"
  },
  {
    "id": "evt-00005",
    "type": "click",
    "userId": "u-10",
    "sessionId": "f7c46850-1522-183d-e174-7bb230db43a2",
    "timestamp": "2025-01-04T04:13:14.000Z",
    "durationMs": 11066,
    "properties": {
      "page": "/search",
      "referrer": "https://ref2.example.com"
    },
    "_partitionKey": "u-10"
  },
  {
    "id": "evt-00006",
    "type": "purchase",
    "userId": "u-5",
    "sessionId": "b7c72938-a3ce-8f87-da89-d1d71ed93189",
    "timestamp": "2025-01-04T02:24:47.000Z",
    "durationMs": 15485,
    "properties": {
      "productId": "prod-2796",
      "amount": 289.47
    },
    "_partitionKey": "u-5"
  },
  {
    "id": "evt-00007",
    "type": "click",
    "userId": "u-8",
    "sessionId": "1a67222f-7f11-22d6-97fa-cb762a3291d6",
    "timestamp": "2025-01-01T15:52:30.000Z",
    "durationMs": 8414,
    "properties": {
      "page": "/home"
    },
    "_partitionKey": "u-8"
  },
  {
    "id": "evt-00008",
    "type": "view",
    "userId": "u-3",
    "sessionId": "487a0834-d91d-a999-54f4-1bf7c8359fa7",
    "timestamp": "2025-01-01T18:22:15.000Z",
    "durationMs": 12453,
    "properties": {
      "page": "/wishlist",
      "productId": "prod-0975"
    },
    "_partitionKey": "u-3"
  },
  {
    "id": "evt-00009",
    "type": "click",
    "userId": "u-2",
    "sessionId": "f87d6c8b-b85e-5615-12e7-d1eb945d75d6",
    "timestamp": "2025-01-05T19:19:20.000Z",
    "durationMs": 21554,
    "properties": {
      "page": "/checkout"
    },
    "_partitionKey": "u-2"
  },
  {
    "id": "evt-00010",
    "type": "view",
    "userId": "u-8",
    "sessionId": "453a4c8a-90fc-7191-7d6e-e6baf90baa9a",
    "timestamp": "2025-01-02T23:07:50.000Z",
    "durationMs": 15325,
    "properties": {
      "page": "/blog",
      "productId": "prod-1195"
    },
    "_partitionKey": "u-8"
  },
  {
    "id": "evt-00011",
    "type": "purchase",
    "userId": "u-5",
    "sessionId": "a099d102-9a4a-2f56-8449-e0420e11fc5a",
    "timestamp": "2025-01-06T15:05:57.000Z",
    "durationMs": 10364,
    "properties": {
      "productId": "prod-0010",
      "amount": 277.85
    },
    "_partitionKey": "u-5"
  },
  {
    "id": "evt-00012",
    "type": "click",
    "userId": "u-2",
    "sessionId": "639a50d5-2cff-d83a-bf08-f68d8b10e1b9",
    "timestamp": "2025-01-04T03:40:18.000Z",
    "durationMs": 7523,
    "properties": {
      "page": "/products"
    },
    "_partitionKey": "u-2"
  },
  {
    "id": "evt-00013",
    "type": "click",
    "userId": "u-1",
    "sessionId": "ac83668d-da54-2831-cc90-b460ee06488f",
    "timestamp": "2025-01-02T12:16:31.000Z",
    "durationMs": 22406,
    "properties": {
      "page": "/home"
    },
    "_partitionKey": "u-1"
  },
  {
    "id": "evt-00014",
    "type": "view",
    "userId": "u-6",
    "sessionId": "beb97c9c-c19e-edf6-9cef-701a505fa3f9",
    "timestamp": "2025-01-05T18:01:53.000Z",
    "durationMs": 7071,
    "properties": {
      "page": "/account",
      "referrer": "https://ref1.example.com",
      "productId": "prod-0129"
    },
    "_partitionKey": "u-6"
  },
  {
    "id": "evt-00015",
    "type": "purchase",
    "userId": "u-10",
    "sessionId": "c078e8f8-c711-e579-5c2f-e6f8fcccaac3",
    "timestamp": "2025-01-01T19:50:00.000Z",
    "durationMs": 11474,
    "properties": {
      "productId": "prod-0729",
      "amount": 127.13
    },
    "_partitionKey": "u-10"
  },
  {
    "id": "evt-00016",
    "type": "view",
    "userId": "u-5",
    "sessionId": "ba8a007d-d9ba-998b-9dbc-0d1715742448",
    "timestamp": "2025-01-04T04:41:21.000Z",
    "durationMs": 3264,
    "properties": {
      "page": "/account",
      "productId": "prod-1332"
    },
    "_partitionKey": "u-5"
  },
  {
    "id": "evt-00017",
    "type": "click",
    "userId": "u-5",
    "sessionId": "7e16e52b-7566-12f2-afcb-2657e51bafb6",
    "timestamp": "2025-01-07T13:36:12.000Z",
    "durationMs": 28328,
    "properties": {
      "page": "/checkout"
    },
    "_partitionKey": "u-5"
  },
  {
    "id": "evt-00018",
    "type": "view",
    "userId": "u-5",
    "sessionId": "2755a910-90b4-6924-4dfa-8cff9783b7bd",
    "timestamp": "2025-01-02T13:13:44.000Z",
    "durationMs": 15393,
    "properties": {
      "page": "/account",
      "referrer": "https://ref5.example.com",
      "productId": "prod-0532"
    },
    "_partitionKey": "u-5"
  },
  {
    "id": "evt-00019",
    "type": "view",
    "userId": "u-2",
    "sessionId": "c331e1ec-1a21-6dca-c864-6ef81d9216bc",
    "timestamp": "2025-01-01T10:28:20.000Z",
    "durationMs": 27151,
    "properties": {
      "page": "/products",
      "productId": "prod-2684"
    },
    "_partitionKey": "u-2"
  },
  {
    "id": "evt-00020",
    "type": "view",
    "userId": "u-1",
    "sessionId": "3e7b4112-bb20-be08-6b5c-5665448ae894",
    "timestamp": "2025-01-05T07:59:10.000Z",
    "durationMs": 27930,
    "properties": {
      "page": "/about",
      "productId": "prod-1420"
    },
    "_partitionKey": "u-1"
  },
  {
    "id": "evt-00021",
    "type": "view",
    "userId": "u-6",
    "sessionId": "7e6fff51-58ed-b58b-3192-6ad1fefa638b",
    "timestamp": "2025-01-04T10:43:24.000Z",
    "durationMs": 13534,
    "properties": {
      "page": "/blog",
      "productId": "prod-0867"
    },
    "_partitionKey": "u-6"
  },
  {
    "id": "evt-00022",
    "type": "purchase",
    "userId": "u-8",
    "sessionId": "50d29834-42c2-8076-b3e2-327f36961f52",
    "timestamp": "2025-01-04T19:37:40.000Z",
    "durationMs": 25499,
    "properties": {
      "productId": "prod-1993",
      "amount": 203.03
    },
    "_partitionKey": "u-8"
  },
  {
    "id": "evt-00023",
    "type": "click",
    "userId": "u-4",
    "sessionId": "b3bc0215-01f9-0eec-e4e7-8bc6d93b58d6",
    "timestamp": "2025-01-07T05:02:47.000Z",
    "durationMs": 2594,
    "properties": {
      "page": "/home",
      "referrer": "https://ref2.example.com"
    },
    "_partitionKey": "u-4"
  },
  {
    "id": "evt-00024",
    "type": "click",
    "userId": "u-9",
    "sessionId": "a099e806-28f5-db42-ad0e-25bf7954fa09",
    "timestamp": "2025-01-07T12:35:57.000Z",
    "durationMs": 26215,
    "properties": {
      "page": "/search"
    },
    "_partitionKey": "u-9"
  },
  {
    "id": "evt-00025",
    "type": "click",
    "userId": "u-3",
    "sessionId": "9664a244-ce71-78e4-1f24-5301a5443d57",
    "timestamp": "2025-01-04T03:00:57.000Z",
    "durationMs": 19476,
    "properties": {
      "page": "/home"
    },
    "_partitionKey": "u-3"
  },
  {
    "id": "evt-00026",
    "type": "signup",
    "userId": "u-9",
    "sessionId": "602fedf9-4c9c-99b7-83b9-b360af19f3bc",
    "timestamp": "2025-01-02T15:30:36.000Z",
    "durationMs": null,
    "properties": {},
    "_partitionKey": "u-9"
  },
  {
    "id": "evt-00027",
    "type": "click",
    "userId": "u-9",
    "sessionId": "422f6eea-b0f7-9a5f-d4ca-fa92ee996f6a",
    "timestamp": "2025-01-07T19:20:10.000Z",
    "durationMs": 2266,
    "properties": {
      "page": "/wishlist",
      "referrer": "https://ref1.example.com"
    },
    "_partitionKey": "u-9"
  },
  {
    "id": "evt-00028",
    "type": "click",
    "userId": "u-5",
    "sessionId": "d68ba18c-ce8c-2c0f-741d-1f06885f8820",
    "timestamp": "2025-01-01T14:15:50.000Z",
    "durationMs": 10329,
    "properties": {
      "page": "/search",
      "referrer": "https://ref3.example.com"
    },
    "_partitionKey": "u-5"
  },
  {
    "id": "evt-00029",
    "type": "view",
    "userId": "u-6",
    "sessionId": "1fcf762c-3793-826e-8b55-efe6beec3e97",
    "timestamp": "2025-01-03T14:05:12.000Z",
    "durationMs": 18368,
    "properties": {
      "page": "/cart",
      "productId": "prod-1074"
    },
    "_partitionKey": "u-6"
  },
  {
    "id": "evt-00030",
    "type": "click",
    "userId": "u-3",
    "sessionId": "f18203fb-0399-5dce-93eb-30ede2c04211",
    "timestamp": "2025-01-03T13:43:33.000Z",
    "durationMs": 7138,
    "properties": {
      "page": "/checkout",
      "referrer": "https://ref5.example.com"
    },
    "_partitionKey": "u-3"
  },
  {
    "id": "evt-00031",
    "type": "view",
    "userId": "u-4",
    "sessionId": "6602abad-0e6e-7610-69fc-58dba9c8e8cd",
    "timestamp": "2025-01-02T15:14:54.000Z",
    "durationMs": 20693,
    "properties": {
      "page": "/about",
      "productId": "prod-0698"
    },
    "_partitionKey": "u-4"
  },
  {
    "id": "evt-00032",
    "type": "view",
    "userId": "u-4",
    "sessionId": "d4099317-0a79-10c7-a8cc-ee0bb64e6380",
    "timestamp": "2025-01-07T12:45:41.000Z",
    "durationMs": 18259,
    "properties": {
      "page": "/blog",
      "productId": "prod-2463"
    },